comment_id,answer_id,question_id,content,content_length,like_count,reply_count,publish_time,parent_id,crawled_at
11090140544,3623454559,663373503,这大哥的核心思想就是不撞南墙不回头，差不多就是甲方问他原材料价格上涨了要怎么维持沉成本，他回答“你不实践怎么知道？你还没生产怎么对产品负责？”,71,9,22,2025-01-16 02:35:36,0,2026-06-23 16:08:05
10995599079,3623454559,663373503,笑死人了，是因为亲戚朋友同事趟过结婚的路了！,22,8,6,2024-09-19 03:31:28,0,2026-06-23 16:08:05
11064906613,3623454559,663373503,还实践，你真的要笑死我了，这种事情谁敢实践啊,22,4,5,2024-12-14 16:28:41,0,2026-06-23 16:08:05
11172600109,3623454559,663373503,实践失败怎么办，生出来孩子给他塞回去？,19,2,3,2025-05-08 08:55:00,0,2026-06-23 16:08:05
11258588955,3623454559,663373503,因为网络？真以为我没当过小孩是吧？,17,3,1,2025-08-12 15:21:07,0,2026-06-23 16:08:05
11100212766,3623454559,663373503,站着说话不腰疼。,8,3,1,2025-01-30 06:51:58,0,2026-06-23 16:08:05
11318939568,3623454559,663373503,理想车主啊，懂了懂了,10,2,0,2025-10-18 23:09:56,0,2026-06-23 16:08:05
11051042207,3623454559,663373503,小概率事件遇上一条你就要完蛋，中国人最缺的就是婚姻容错率，娶了红太狼比吸毒还麻烦,40,1,4,2024-11-26 11:58:34,0,2026-06-23 16:08:05
11029935256,19734104896,2715523183,大佬说的都对，讨论就不必了，在上面看来，都是老百姓不体谅朝廷的难处，所以我们一没那个没资格，二没那么高的觉悟，就只能用行动表态了。,65,302,22,2024-10-31 15:00:40,0,2026-06-23 16:08:10
11030103532,19734104896,2715523183,每次我对自己不婚不育的晚年生活感到一点恐惧的时候我就随便看看新闻，看完就又能放下了,41,205,25,2024-10-31 13:17:58,0,2026-06-23 16:08:10
11030454038,19734104896,2715523183,根据上次的关于促进生育的报告来看，但凡是提到了房地产问题，工作时间过长问题，社会压力过大问题，都立刻被批评是狭隘的，是贪图享乐的，是不客观的。,71,148,17,2024-10-31 20:22:08,0,2026-06-23 16:08:10
11030657447,19734104896,2715523183,这就又回到了中学政治课本回答的两个问题：国家的定义是什么？国家是谁的国家？,37,123,10,2024-10-31 16:50:47,0,2026-06-23 16:08:10
11030626886,19734104896,2715523183,人口问题是大事，可我到现在都无法理解右人口口声声爱国，却在人口问题上反对一切对家庭和个人福利有利的长期措施然后看着人口问题继续烂下去，天天说企业好难，当官的好难，唯独老百姓不难，真是无语,93,77,20,2024-10-31 15:16:08,0,2026-06-23 16:08:10
11030107521,19734104896,2715523183,无论对于国家和个人，放弃生育的危害是遥远的、抽象的，对于老龄化的焦虑总是可以用“到时候再说”“说不定没那么糟糕呢”等等理由搪塞过去。但选择生育的现实困难却是实实在在摆在面前的，彩礼，房车，工作稳定性，食品安全，内卷焦虑等等。因为人是全部社会实践的主体，所以理论上全部社会负面新闻都会加深婚育恐惧。人口问题本身不是问题，也是最大的问题，其本身是所有社会问题的结果，是生存环境的评分，指望头痛医头式的解决问题不会有结果，当社会真的适合生育不用促进生育率也会回升,228,62,9,2024-10-31 16:18:12,0,2026-06-23 16:08:10
11030540975,19734104896,2715523183,可是，村口的那些计生标语有人敢说它是错的吗？这些标语可不只是反婚反育了,35,33,13,2024-10-31 16:40:41,0,2026-06-23 16:08:10
11030280458,19734104896,2715523183,与其通过多开会、多发文的方式，从道德层面谴责生不起、养不起、害怕将来对不起孩子、根本就没有时间也没有空间生孩子、养孩子的穷人，从精神层面不遗余力地催促穷人生孩子，造成更多家庭悲剧，不如直接向真正有意愿也有能力的富人摊派生育指标，最起码还有几分可行性，不会沦为一纸空文，既提高生育率，又促进消费，一举两得，皆大欢喜。,157,35,4,2024-10-31 16:32:45,0,2026-06-23 16:08:10
11030542477,19734104896,2715523183,宏观的不作为，感觉说的真是够委婉的,17,28,3,2024-10-31 18:51:12,0,2026-06-23 16:08:10
11030022732,19734104896,2715523183,这种反婚反育只是结果不是原因，想想因是什么,21,25,14,2024-10-31 22:59:35,0,2026-06-23 16:08:10
11064653308,51329994099,6220733569,这个题主；想给我换危险的ip地址，妹子 你觉得讽刺吗,26,0,0,2024-12-13 22:03:55,0,2026-06-23 16:08:17
